{
  "schema_version": 1,
  "feedback_id": "calibration-q21-20260730",
  "session_id": "teacher-calibration-20260730",
  "courseware_id": "q21-variable-field-rod-3d",
  "reviewer_role": "teacher",
  "reviewed_at": "2026-07-30T10:35:00+08:00",
  "dimensions": {
    "causal_presentation": {"verdict": "pass", "note": "校准结论：本维通过；未补写老师未提供的逐条原话。"},
    "process_visibility": {"verdict": "pass", "note": "校准结论：本维通过；未补写老师未提供的逐条原话。"},
    "effective_interaction": {"verdict": "pass", "note": "校准结论：本维通过；未补写老师未提供的逐条原话。"},
    "task_driven": {"verdict": "pass", "note": "校准结论：本维通过；未补写老师未提供的逐条原话。"},
    "verifiability": {"verdict": "pass", "note": "校准结论：本维通过；未补写老师未提供的逐条原话。"},
    "exam_connection": {"verdict": "fail", "note": "老师校准认为课件虽能展示过程和关系图，但学生仍缺少从条件与阶段到规律、方程、选项判断和变式迁移的显式桥梁。"}
  },
  "overall": {
    "verdict": "reject",
    "rejection_reasons": ["exam_connection"],
    "note": "前五维通过；本次因“与解题的衔接”未通过而打回，作为第1题迭代的校准基线。"
  }
}
